"code","ALT_CODE","USAGE","USAGE_UK","DESCRIPTION","MODIFIER_4","MODIFIER_5","QUALIFIERS","GENDER_MASK","MIN_AGE","MAX_AGE","TREE_DESCRIPTION"
"C81","C81","DEFAULT","3","Hodgkin lymphoma","","","",,,,""
"C81.0","C810","DEFAULT","3","Nodular lymphocyte predominant Hodgkin lymphoma","","","",,,,"Nodular lymphocyte predominant Hodgkin lymphoma"
"C81.1","C811","DEFAULT","3","Nodular sclerosis (classical) Hodgkin lymphoma","","","",,,,"Nodular sclerosis (classical) Hodgkin lymphoma"
"C81.2","C812","DEFAULT","3","Mixed cellularity (classical) Hodgkin lymphoma","","","",,,,"Mixed cellularity (classical) Hodgkin lymphoma"
"C81.3","C813","DEFAULT","3","Lymphocyte depleted (classical) Hodgkin lymphoma","","","",,,,""
"C81.4","C814","DEFAULT","3","Lymphocyte-rich (classical) Hodgkin lymphoma","","","",,,,""
"C81.7","C817","DEFAULT","3","Other (classical) Hodgkin lymphoma","","","",,,,""
"C81.9","C819","DEFAULT","3","Hodgkin lymphoma, unspecified","","","",,,,"Hodgkin lymphoma, unspecified"
